id,conversation_id,created_at,date,time,timezone,user_id,username,name,place,tweet,mentions,urls,photos,replies_count,retweets_count,likes_count,hashtags,cashtags,link,retweet,quote_url,video,near,geo,source,user_rt_id,user_rt,retweet_id,reply_to,retweet_date,translate,trans_src,trans_dest
1242362056335978497,1242362054222073857,1585037170000,2020-03-24,13:36:10,IST,16359535,friedberg,david friedberg,,"4/25: Children Fall Ill in New York, Swine Flu is Likely Cause 4/26: US Declares Public Health Emergency Over Swine Flu 4/29: Mexican Child Visiting U.S. First to Die Here of Swine Flu; Containing Flu is Not Feasible Experts Say 4/30: Flu Prompts Shutdowns in Mexico/Texas ..",[],[],[],1,0,1,[],[],https://twitter.com/friedberg/status/1242362056335978497,False,,0,,,,,,,"[{'user_id': '16359535', 'username': 'friedberg'}]",,,,
1242362054222073857,1242362054222073857,1585037170000,2020-03-24,13:36:10,IST,16359535,friedberg,david friedberg,,"chronological headlines from NYT in 2009 re H1N1 pandemic.. 1/8: Flu in U.S. Found Resistant to Antiviral Drug 2/8: China logs 8th reported case of bird flu this year 2/22: Antibodies Offer a New Path for Fighting Flu 4/24: Fighting Deadly Flu, Mexico Shuts Schools ..",[],[],[],3,2,12,[],[],https://twitter.com/friedberg/status/1242362054222073857,False,,0,,,,,,,"[{'user_id': '16359535', 'username': 'friedberg'}]",,,,
1242348434251632641,1242348431290429443,1585033923000,2020-03-24,12:42:03,IST,16359535,friedberg,david friedberg,,"“Ventilators cost $30,000 each, though models as cheap as $100 are stockpiled for pandemics.” ..  it seems everything old is new again.",[],[],[],0,0,11,[],[],https://twitter.com/friedberg/status/1242348434251632641,False,,0,,,,,,,"[{'user_id': '16359535', 'username': 'friedberg'}]",,,,
1242348433446293505,1242348431290429443,1585033922000,2020-03-24,12:42:02,IST,16359535,friedberg,david friedberg,,"“You want to shift the curve to the right, blunt the peaks and squash the area under them, Blunting the peaks of new cases decreases demand on hospitals, so patients do not have to be triaged off ventilators to die because others are waiting.”..",[],[],[],1,0,5,[],[],https://twitter.com/friedberg/status/1242348433446293505,False,,0,,,,,,,"[{'user_id': '16359535', 'username': 'friedberg'}]",,,,
1242348432787816448,1242348431290429443,1585033922000,2020-03-24,12:42:02,IST,16359535,friedberg,david friedberg,,"“You cut those off and you cripple the health care system, Our global just-in-time economy means we are dependent on others. Much of our food is from overseas. A Kellogg’s Nutri-Grain bar has ingredients from nine countries in it.” ..",[],[],[],1,0,5,[],[],https://twitter.com/friedberg/status/1242348432787816448,False,,0,,,,,,,"[{'user_id': '16359535', 'username': 'friedberg'}]",,,,
1242348431974084608,1242348431290429443,1585033922000,2020-03-24,12:42:02,IST,16359535,friedberg,david friedberg,,"“including most masks, gowns and gloves, electrical circuits for ventilators and communications gear, and pharmaceutical drugs and the raw materials to make them.”..",[],[],[],1,0,6,[],[],https://twitter.com/friedberg/status/1242348431974084608,False,,0,,,,,,,"[{'user_id': '16359535', 'username': 'friedberg'}]",,,,
1242348431290429443,1242348431290429443,1585033922000,2020-03-24,12:42:02,IST,16359535,friedberg,david friedberg,,"been re-reading articles from 09 H1N1 pandemic. NYT article “Containing Flu is Not Feasible, Specialists Say” .. “Closing borders is dangerous because many goods needed in a pandemic are made abroad” “...",[],[],[],4,9,27,[],[],https://twitter.com/friedberg/status/1242348431290429443,False,,0,,,,,,,"[{'user_id': '16359535', 'username': 'friedberg'}]",,,,
1242343378852794368,1242343378852794368,1585032717000,2020-03-24,12:21:57,IST,16359535,friedberg,david friedberg,,the CDC has had a Natl Pandemic Flu Plan and Natl Strategy for Pandemic Flu printed every year since 2005. this seems to have stopped in 2017 after the new administration took office. last versions still accessible..  https://www.cdc.gov/flu/pandemic-resources/index.htm …  https://www.cdc.gov/flu/pandemic-resources/national-strategy/index.html …,[],"['https://www.cdc.gov/flu/pandemic-resources/index.htm', 'https://www.cdc.gov/flu/pandemic-resources/national-strategy/index.html']",[],1,7,13,[],[],https://twitter.com/friedberg/status/1242343378852794368,False,,0,,,,,,,"[{'user_id': '16359535', 'username': 'friedberg'}]",,,,
1242291739584425985,1242291739584425985,1585020406000,2020-03-24,08:56:46,IST,16359535,friedberg,david friedberg,,another beauty - down and to the right in Seattle (these guys test most of the WA state suspected cases) ...  http://depts.washington.edu/labmed/covid19/ ,[],['http://depts.washington.edu/labmed/covid19/'],[],2,4,25,[],[],https://twitter.com/friedberg/status/1242291739584425985,False,,0,,,,,,,"[{'user_id': '16359535', 'username': 'friedberg'}]",,,,
1242291010765348867,1242291010765348867,1585020232000,2020-03-24,08:53:52,IST,16359535,friedberg,david friedberg,,not sure i've been more excited about a chart where the numbers are down and to the right... pic.twitter.com/THJsYVe5PW,[],[],"['https://pbs.twimg.com/media/ET2A40eUwAEDYp-.jpg', 'https://pbs.twimg.com/media/ET2A5_VUcAM-0MK.jpg']",11,47,290,[],[],https://twitter.com/friedberg/status/1242291010765348867,False,,0,,,,,,,"[{'user_id': '16359535', 'username': 'friedberg'}]",,,,
1242288612407820291,1242288612407820291,1585019660000,2020-03-24,08:44:20,IST,16359535,friedberg,david friedberg,,this. https://twitter.com/NateSilver538/status/1242208166202478593 …,[],['https://twitter.com/NateSilver538/status/1242208166202478593'],[],1,3,8,[],[],https://twitter.com/friedberg/status/1242288612407820291,False,https://twitter.com/NateSilver538/status/1242208166202478593,0,,,,,,,"[{'user_id': '16359535', 'username': 'friedberg'}]",,,,
1241966946888769536,1240101746648612864,1584942969000,2020-03-23,11:26:09,IST,16359535,friedberg,david friedberg,, https://twitter.com/uwvirology/status/1241837591240028165?s=21 …,['codeboss911'],['https://twitter.com/uwvirology/status/1241837591240028165?s=21'],[],1,0,1,[],[],https://twitter.com/friedberg/status/1241966946888769536,False,https://twitter.com/UWVirology/status/1241837591240028165,0,,,,,,,"[{'user_id': '16359535', 'username': 'friedberg'}, {'user_id': '999923604102889472', 'username': 'CodeBoss911'}]",,,,
1241933461545299968,1241933458395430913,1584934985000,2020-03-23,09:13:05,IST,16359535,friedberg,david friedberg,,"this is an unprecedented, extraordinary, and rapid shift in the nature of our Nation brought about as a war is waged with an enemy we can not see. a pivotal week of history is ahead. unbelievable times",[],[],[],1,0,17,[],[],https://twitter.com/friedberg/status/1241933461545299968,False,,0,,,,,,,"[{'user_id': '16359535', 'username': 'friedberg'}]",,,,
1241933460878442497,1241933458395430913,1584934985000,2020-03-23,09:13:05,IST,16359535,friedberg,david friedberg,,"tonight, Congress is debating what industries to keep (bailout) and which ones to shut down (don’t bailout), and this centralized planning will chart the course of nearly every business and worker for the decade ahead..",[],[],[],1,2,8,[],[],https://twitter.com/friedberg/status/1241933460878442497,False,,0,,,,,,,"[{'user_id': '16359535', 'username': 'friedberg'}]",,,,
1241933460018626560,1241933458395430913,1584934985000,2020-03-23,09:13:05,IST,16359535,friedberg,david friedberg,,"through the invocation of the Defense Production Act telling factories what to make, providing and managing healthcare on a natl scale, the Fed is buying and will soon own a large amount of US corporate debt (and thus be in an economic control position across many industries), ..",[],[],[],1,0,5,[],[],https://twitter.com/friedberg/status/1241933460018626560,False,,0,,,,,,,"[{'user_id': '16359535', 'username': 'friedberg'}]",,,,
1241933458949066752,1241933458395430913,1584934985000,2020-03-23,09:13:05,IST,16359535,friedberg,david friedberg,,"soon, the govt will be sending full paychecks to a large swath of the workforce, is telling every individual where to be and what not to do (stay home, don’t gather in public), has eliminated free commerce (most businesses now shut due to govt imposed restrictions), ...",[],[],[],1,0,7,[],[],https://twitter.com/friedberg/status/1241933458949066752,False,,0,,,,,,,"[{'user_id': '16359535', 'username': 'friedberg'}]",,,,
1241933458395430913,1241933458395430913,1584934985000,2020-03-23,09:13:05,IST,16359535,friedberg,david friedberg,,"the US is becoming a De Facto Socialist state (not a critical statement, just an observation)..",[],[],[],4,0,20,[],[],https://twitter.com/friedberg/status/1241933458395430913,False,,0,,,,,,,"[{'user_id': '16359535', 'username': 'friedberg'}]",,,,
1241927380521725952,1241926581280329729,1584933536000,2020-03-23,08:48:56,IST,16359535,friedberg,david friedberg,,it looks like there is some expedited SBA thing available and they’re trying to make business owners eligible for pay as well.,['arampell'],[],[],2,0,1,[],[],https://twitter.com/friedberg/status/1241927380521725952,False,,0,,,,,,,"[{'user_id': '16359535', 'username': 'friedberg'}, {'user_id': '206938213', 'username': 'arampell'}]",,,,
1241926581280329729,1241926581280329729,1584933345000,2020-03-23,08:45:45,IST,16359535,friedberg,david friedberg,,"i’m optimistic. the senate bill seems to have 4 months of full pay, regardless of worker status for anyone laid off or whose business has been affected, incl part time, ind contractors, and gig workers. this might actually help fill the hole",[],[],[],3,3,27,[],[],https://twitter.com/friedberg/status/1241926581280329729,False,,0,,,,,,,"[{'user_id': '16359535', 'username': 'friedberg'}]",,,,
1241898400716480512,1241858294949523456,1584926626000,2020-03-23,06:53:46,IST,16359535,friedberg,david friedberg,,we got into this nightmare because we didn’t take precaution and action when we could have. right now is another opportunity to get ahead of the next crisis. i am highlighting this risk and recommending specific actions to mitigate.,['charlesscott78'],[],[],1,0,13,[],[],https://twitter.com/friedberg/status/1241898400716480512,False,,0,,,,,,,"[{'user_id': '16359535', 'username': 'friedberg'}, {'user_id': '1225056994198945792', 'username': 'CharlesScott78'}]",,,,
1241897144568532994,1241897144568532994,1584926327000,2020-03-23,06:48:47,IST,16359535,friedberg,david friedberg,,"masks for everyone! wear them starting now every time to you go out. if we all followed this plan, this whole nightmare goes away fast https://twitter.com/wrathofgnon/status/1241594794473746432 …",[],['https://twitter.com/wrathofgnon/status/1241594794473746432'],[],12,38,123,[],[],https://twitter.com/friedberg/status/1241897144568532994,False,https://twitter.com/wrathofgnon/status/1241594794473746432,0,,,,,,,"[{'user_id': '16359535', 'username': 'friedberg'}]",,,,
1241896668787691520,1241895570714677249,1584926213000,2020-03-23,06:46:53,IST,16359535,friedberg,david friedberg,,41% we symptomatic when they were tested. i wonder how many realized symptoms after being told they had coronavirus. iceland data shows 50% of broad population tested showing as completely asymptomatic on test as well,['eladgil'],[],[],0,0,3,[],[],https://twitter.com/friedberg/status/1241896668787691520,False,,0,,,,,,,"[{'user_id': '16359535', 'username': 'friedberg'}, {'user_id': '6535212', 'username': 'eladgil'}]",,,,
1241867539417726976,1241858294949523456,1584919268000,2020-03-23,04:51:08,IST,16359535,friedberg,david friedberg,,with 24/7 masks on everyone there is significantly lower risk of any aerosol droplets. surface contamination minimized with constant decontamination in addition to masks = odds go way down. china and korea employed these protocols with positive results.,"['silli_scientist', 'theory_gang']",[],[],6,1,21,[],[],https://twitter.com/friedberg/status/1241867539417726976,False,,0,,,,,,,"[{'user_id': '16359535', 'username': 'friedberg'}, {'user_id': '253339566', 'username': 'Silli_Scientist'}, {'user_id': '958070347504300033', 'username': 'theory_gang'}]",,,,
1241858299970170880,1241858294949523456,1584917065000,2020-03-23,04:14:25,IST,16359535,friedberg,david friedberg,,we must also be prepared for every facility to have a positive infection with a plan for immediate disinfection and continuity of operations. not hearing about any of this planning.  we need this asap to minimize this critical supply chain risk.,[],[],[],1,2,41,[],[],https://twitter.com/friedberg/status/1241858299970170880,False,,0,,,,,,,"[{'user_id': '16359535', 'username': 'friedberg'}]",,,,
1241858298887970817,1241858294949523456,1584917065000,2020-03-23,04:14:25,IST,16359535,friedberg,david friedberg,,we MUST prioritize doing what china did in ALL factories and warehouses..temp checks on entry. onsite testing. masks+gloves req all times for every employee. sanitizer stations everywhere. we must also clearly communicate to employees at all these facilities abt safety/intent.,[],[],[],3,7,46,[],[],https://twitter.com/friedberg/status/1241858298887970817,False,,0,,,,,,,"[{'user_id': '16359535', 'username': 'friedberg'}]",,,,
1241858297738727436,1241858294949523456,1584917065000,2020-03-23,04:14:25,IST,16359535,friedberg,david friedberg,,"if food is rationed, panic buying ensues. local food supplies dwindle faster. people panic more. etc. and then it becomes a civil issue. this is a very real scenario. what can we do?",[],[],[],1,0,9,[],[],https://twitter.com/friedberg/status/1241858297738727436,False,,0,,,,,,,"[{'user_id': '16359535', 'username': 'friedberg'}]",,,,
1241858296518189056,1241858294949523456,1584917065000,2020-03-23,04:14:25,IST,16359535,friedberg,david friedberg,,"if workers don’t show up (as has happened at ford, gm, fca plants this past week), food supplies locally get reduced. then what happens? govt will step in to “manage”. if that happens, food supplies will be rationed/controlled by govt.",[],[],[],1,0,11,[],[],https://twitter.com/friedberg/status/1241858296518189056,False,,0,,,,,,,"[{'user_id': '16359535', 'username': 'friedberg'}]",,,,
1241858294949523456,1241858294949523456,1584917064000,2020-03-23,04:14:24,IST,16359535,friedberg,david friedberg,,"scenario: workers decide they don’t want to work in factories, warehouses, or distribution centers this week due to fear about covid infection. or a single infection causes facility to shut down. govt can’t just declare it an “essential service” and force workers to show up.",[],[],[],6,7,36,[],[],https://twitter.com/friedberg/status/1241858294949523456,False,,0,,,,,,,"[{'user_id': '16359535', 'username': 'friedberg'}]",,,,
1241611224200007681,1241607630033793026,1584858158000,2020-03-22,11:52:38,IST,16359535,friedberg,david friedberg,,"to be clear, these stats are the published stats of the chinese manufacturers, not to be generalized and unclear if true as no FDA verification has been done",[],[],[],0,0,3,[],[],https://twitter.com/friedberg/status/1241611224200007681,False,,0,,,,,,,"[{'user_id': '16359535', 'username': 'friedberg'}]",,,,
1241607636505657346,1241607630033793026,1584857303000,2020-03-22,11:38:23,IST,16359535,friedberg,david friedberg,,"if these kits do work (and govt is willing to buy from china) US could acquire 10m+ of these tests for $5 apiece and sample population of major US cities could self-administer; quickly estimate true fatality rate, R0, & trace infections",[],[],[],1,0,7,[],[],https://twitter.com/friedberg/status/1241607636505657346,False,,0,,,,,,,"[{'user_id': '16359535', 'username': 'friedberg'}]",,,,
1241607635440300032,1241607630033793026,1584857302000,2020-03-22,11:38:22,IST,16359535,friedberg,david friedberg,,"unfortunately all fed govt resources and hospital/institution/private labs are focused on scaling up daily capacity for PCR testing, with no parallel effort (that has been shared publicly) to test, acquire and use these cheap and readily available kits",[],[],[],1,0,6,[],[],https://twitter.com/friedberg/status/1241607635440300032,False,,0,,,,,,,"[{'user_id': '16359535', 'username': 'friedberg'}]",,,,
1241607634769174528,1241607630033793026,1584857302000,2020-03-22,11:38:22,IST,16359535,friedberg,david friedberg,,"was told NO ACTIVITY by US govt (federal or local) to buy these tests but lots of private sector interest and tons of folks trying to import and use in US. 1m+ expected to start hitting the US this week .. not FDA approved for diagnostics, questionable use for research. why?",[],[],[],1,1,3,[],[],https://twitter.com/friedberg/status/1241607634769174528,False,,0,,,,,,,"[{'user_id': '16359535', 'username': 'friedberg'}]",,,,
1241607634123255808,1241607630033793026,1584857302000,2020-03-22,11:38:22,IST,16359535,friedberg,david friedberg,,"claim that these tests are WHO authorized and being used in korea, australia and italy and that germany just placed an order for 9m tests but i have not been able to independently verify these statements.. if true seems like germany may be testing large % of population",[],[],[],1,0,3,[],[],https://twitter.com/friedberg/status/1241607634123255808,False,,0,,,,,,,"[{'user_id': '16359535', 'username': 'friedberg'}]",,,,
1241607632793698304,1241607630033793026,1584857302000,2020-03-22,11:38:22,IST,16359535,friedberg,david friedberg,,i have done some digging on these tests.. was told there are 2 factories in China authorized to make the approved (by chinese govt) test kits... total production appears to be 1m kits/day. there are also lots of fakes/scams making their way into market,[],[],[],2,0,2,[],[],https://twitter.com/friedberg/status/1241607632793698304,False,,0,,,,,,,"[{'user_id': '16359535', 'username': 'friedberg'}]",,,,
1241607632101597184,1241607630033793026,1584857302000,2020-03-22,11:38:22,IST,16359535,friedberg,david friedberg,,"test requires a few drops of blood on a stick from a finger prick. IgM antibodies show up 3-10 days after an active infection and last several months, IgG antibodies show up weeks after an active infection and last years",[],[],[],1,0,4,[],[],https://twitter.com/friedberg/status/1241607632101597184,False,,0,,,,,,,"[{'user_id': '16359535', 'username': 'friedberg'}]",,,,
1241607630734290944,1241607630033793026,1584857301000,2020-03-22,11:38:21,IST,16359535,friedberg,david friedberg,,a big benefit of these tests is time and cost - they take 10 minutes and cost pennies to dollars. as such they can be deployed widely and used for figuring out the true infected population count and tracing/tracking infections over time and space,[],[],[],1,0,4,[],[],https://twitter.com/friedberg/status/1241607630734290944,False,,0,,,,,,,"[{'user_id': '16359535', 'username': 'friedberg'}]",,,,
1241607630033793026,1241607630033793026,1584857301000,2020-03-22,11:38:21,IST,16359535,friedberg,david friedberg,,IgM and IgG antibody tests are not a replacement for RT-PCR tests in diagnosing an active SARS-COV-2 infection. the IgG/IgM tests can be used to identify a past infection - useful for finding asymptomatic ppl; typically ~10% false negative and <1% false positive,[],[],[],3,6,25,[],[],https://twitter.com/friedberg/status/1241607630033793026,False,,0,,,,,,,"[{'user_id': '16359535', 'username': 'friedberg'}]",,,,
1241401655209283584,1241395023905579009,1584808193000,2020-03-21,21:59:53,IST,16359535,friedberg,david friedberg,,saw pic.twitter.com/48SUa5RU7U,[],[],['https://pbs.twimg.com/media/ETpYOQGUEAExYqm.jpg'],0,0,7,[],[],https://twitter.com/friedberg/status/1241401655209283584,False,,0,,,,,,,"[{'user_id': '16359535', 'username': 'friedberg'}]",,,,
1241401648129306630,1241395023905579009,1584808191000,2020-03-21,21:59:51,IST,16359535,friedberg,david friedberg,, pic.twitter.com/zg1K4l6mWa,[],[],['https://pbs.twimg.com/media/ETpYN9xUYAAX8O4.jpg'],1,1,20,[],[],https://twitter.com/friedberg/status/1241401648129306630,False,,0,,,,,,,"[{'user_id': '16359535', 'username': 'friedberg'}]",,,,
1241395023905579009,1241395023905579009,1584806612000,2020-03-21,21:33:32,IST,16359535,friedberg,david friedberg,,everything in the universe looks exponential until it reveals itself to be sigmoidal.,[],[],[],10,33,209,[],[],https://twitter.com/friedberg/status/1241395023905579009,False,,0,,,,,,,"[{'user_id': '16359535', 'username': 'friedberg'}]",,,,
1241185540071817216,1241185540071817216,1584756667000,2020-03-21,07:41:07,IST,16359535,friedberg,david friedberg,,"looks like bernie sanders is gonna get what he wants.. no more student debt payments, federal paychecks to all, government run healthcare, and no more millionaires or billionaires",[],[],[],5,5,46,[],[],https://twitter.com/friedberg/status/1241185540071817216,False,,0,,,,,,,"[{'user_id': '16359535', 'username': 'friedberg'}]",,,,
1241090677129146368,1240823215624048640,1584734050000,2020-03-21,01:24:10,IST,16359535,friedberg,david friedberg,,"agree w everything u said iceland not predictor for anything except what their cohort represents (young, low a1c, uniform hla etc). point is that, along w other data, we may be missing US/italy cohort of asymptomatic; accurate range of severity/fatality matters for policy setting","['matildaalistar', 'westcoastbill']",[],[],0,0,1,[],[],https://twitter.com/friedberg/status/1241090677129146368,False,,0,,,,,,,"[{'user_id': '16359535', 'username': 'friedberg'}, {'user_id': '701097808145817602', 'username': 'MatildaAlistar'}, {'user_id': '692023', 'username': 'westcoastbill'}]",,,,
1241036205535285248,1241036205535285248,1584721063000,2020-03-20,21:47:43,IST,16359535,friedberg,david friedberg,,the whole world experience has become like a bad episode of black mirror,[],[],[],39,181,2134,[],[],https://twitter.com/friedberg/status/1241036205535285248,False,,0,,,,,,,"[{'user_id': '16359535', 'username': 'friedberg'}]",,,,
1240759058845466625,1240759058111401984,1584654986000,2020-03-20,03:26:26,IST,16359535,friedberg,david friedberg,,food supply chains getting disrupted takes this whole thing to another level of crisis,[],[],[],3,5,53,[],[],https://twitter.com/friedberg/status/1240759058845466625,False,,0,,,,,,,"[{'user_id': '16359535', 'username': 'friedberg'}]",,,,
1240759058111401984,1240759058111401984,1584654986000,2020-03-20,03:26:26,IST,16359535,friedberg,david friedberg,,i am really concerned about the precedent of closing factories. amazon just closed a warehouse. all food moves through factories and warehouses. yday i spoke with a C level at big food co w dozens of factories. they are planning shutdowns if someone tests positive in a factory,[],[],[],5,12,102,[],[],https://twitter.com/friedberg/status/1240759058111401984,False,,0,,,,,,,"[{'user_id': '16359535', 'username': 'friedberg'}]",,,,
1240748973830234112,1240747551961169920,1584652582000,2020-03-20,02:46:22,IST,16359535,friedberg,david friedberg,,nearly half of what amazon sells through its warehouses is food,['ryanpsawyer'],[],[],1,1,7,[],[],https://twitter.com/friedberg/status/1240748973830234112,False,,0,,,,,,,"[{'user_id': '16359535', 'username': 'friedberg'}, {'user_id': '1616185286', 'username': 'ryanpsawyer'}]",,,,
1240747552728702977,1240747551961169920,1584652243000,2020-03-20,02:40:43,IST,16359535,friedberg,david friedberg,,"we must protect workers (masks. cleaning stations, etc), make reasonable policy decisions (when to shut down a plant based on estimated risk, not worst-case assumption), provide cheap ELISA test kits (not PCR) to factories to use onsite for concerned workers, and govt aid to help",[],[],[],0,1,24,[],[],https://twitter.com/friedberg/status/1240747552728702977,False,,0,,,,,,,"[{'user_id': '16359535', 'username': 'friedberg'}]",,,,
1240747551961169920,1240747551961169920,1584652243000,2020-03-20,02:40:43,IST,16359535,friedberg,david friedberg,,"this is what's most scary... if food supply chain infrastructure gets shut down due to coronavirus, we will enter a new phase of crisis. almost all food we eat goes through factories and/or warehouses... https://techcrunch.com/2020/03/19/workers-sent-home-after-amazon-warehouse-employee-tests-positive-for-covid-19/ …",[],['https://techcrunch.com/2020/03/19/workers-sent-home-after-amazon-warehouse-employee-tests-positive-for-covid-19/'],[],7,7,41,[],[],https://twitter.com/friedberg/status/1240747551961169920,False,,0,,,,,,,"[{'user_id': '16359535', 'username': 'friedberg'}]",,,,
1240715498058219520,1240715489929621506,1584644600000,2020-03-20,00:33:20,IST,16359535,friedberg,david friedberg,,"small business revenue:
 https://www.census.gov/programs-surveys/ase.html …
small business cash:
 https://www.forbes.com/sites/jpmorganchase/2017/03/17/new-study-finds-majority-of-small-businesses-unprepared-for-cash-crisis/#55d6e4004d89 …
small business margins:
 https://www.aei.org/carpe-diem/the-public-thinks-the-average-company-makes-a-36-profit-margin-which-is-about-5x-too-high/ …
union square layoffs:
 https://ny.eater.com/2020/3/18/21185090/union-square-hospitality-group-layoffs-coronavirus-nyc …
mortality study:
 https://www.sciencedirect.com/science/article/abs/pii/S027795361400269X …
mortality table:
 https://www.statista.com/statistics/241572/death-rate-by-age-and-sex-in-the-us/ …",[],"['https://www.census.gov/programs-surveys/ase.html', 'https://www.forbes.com/sites/jpmorganchase/2017/03/17/new-study-finds-majority-of-small-businesses-unprepared-for-cash-crisis/#55d6e4004d89', 'https://www.aei.org/carpe-diem/the-public-thinks-the-average-company-makes-a-36-profit-margin-which-is-about-5x-too-high/', 'https://ny.eater.com/2020/3/18/21185090/union-square-hospitality-group-layoffs-coronavirus-nyc', 'https://www.sciencedirect.com/science/article/abs/pii/S027795361400269X', 'https://www.statista.com/statistics/241572/death-rate-by-age-and-sex-in-the-us/']",[],1,0,7,[],[],https://twitter.com/friedberg/status/1240715498058219520,False,,0,,,,,,,"[{'user_id': '16359535', 'username': 'friedberg'}]",,,,
