id,conversation_id,created_at,date,time,timezone,user_id,username,name,place,tweet,mentions,urls,photos,replies_count,retweets_count,likes_count,hashtags,cashtags,link,retweet,quote_url,video,near,geo,source,user_rt_id,user_rt,retweet_id,reply_to,retweet_date,translate,trans_src,trans_dest
1240715497303232512,1240715489929621506,1584644600000,2020-03-20,00:33:20,IST,16359535,friedberg,david friedberg,,"please note: these numbers are theoretical (and riddled with errors), but i am trying to highlight that there is a human toll to the shutdown that may impact us more than the toll of the pandemic itself. the q is when do we cross the line and policy becomes net-negative?",[],[],[],2,2,14,[],[],https://twitter.com/friedberg/status/1240715497303232512,False,,0,,,,,,,"[{'user_id': '16359535', 'username': 'friedberg'}]",,,,
1240715496388841472,1240715489929621506,1584644600000,2020-03-20,00:33:20,IST,16359535,friedberg,david friedberg,,this analysis doesn't even account for the quality of life effects... how many people living on unemployment will find their way to opioids? how many will see the effects of depression? homelessness?,[],[],[],1,0,4,[],[],https://twitter.com/friedberg/status/1240715496388841472,False,,0,,,,,,,"[{'user_id': '16359535', 'username': 'friedberg'}]",,,,
1240715495596122112,1240715489929621506,1584644600000,2020-03-20,00:33:20,IST,16359535,friedberg,david friedberg,,"if we are increasing our national unemployment rate by 5% for each week we are shutdown, it could be argued we are increasing next-year mortality in the working population by 110k people.. a 5-week shutdown would result in half a million incremental deaths in a year",[],[],[],1,1,5,[],[],https://twitter.com/friedberg/status/1240715495596122112,False,,0,,,,,,,"[{'user_id': '16359535', 'username': 'friedberg'}]",,,,
1240715494849572864,1240715489929621506,1584644600000,2020-03-20,00:33:20,IST,16359535,friedberg,david friedberg,,"6% increase of 227 is 14; thus, assuming a 160m working population in US, a 1% increase in unemployment would increase next-year mortality by 22,400 people; each 5% increment in unemployment is 110k incremental deaths",[],[],[],1,0,6,[],[],https://twitter.com/friedberg/status/1240715494849572864,False,,0,,,,,,,"[{'user_id': '16359535', 'username': 'friedberg'}]",,,,
1240715494098743298,1240715489929621506,1584644599000,2020-03-20,00:33:19,IST,16359535,friedberg,david friedberg,,what does unemployment do to mortality rates? this is hotly debated but a study (below) shows each 1% increment in unemployment increases next-year mortality by 6%. median age in US is 38. one-year mortality for a 38 yr old is 227//100k..,[],[],[],1,0,4,[],[],https://twitter.com/friedberg/status/1240715494098743298,False,,0,,,,,,,"[{'user_id': '16359535', 'username': 'friedberg'}]",,,,
1240715492987301888,1240715489929621506,1584644599000,2020-03-20,00:33:19,IST,16359535,friedberg,david friedberg,,"based on a distribution of circumstances (cash balance, headcount, rev impact etc by different sectors), we can probably assume 5% reduction in headcount for each week without revenue. yesterday, a major NY restaurant chain laid off 90% of employees (2000 ppl) in a day",[],[],[],1,0,3,[],[],https://twitter.com/friedberg/status/1240715492987301888,False,,0,,,,,,,"[{'user_id': '16359535', 'username': 'friedberg'}]",,,,
1240715492089724928,1240715489929621506,1584644599000,2020-03-20,00:33:19,IST,16359535,friedberg,david friedberg,,"median small bus revenue is $390k, with 7% op margins, and $12k cash balance (sources provided at end); losing 100% of revenue means 2 weeks of cash if operating expenses stay up! thus, they need to cut employees asap..",[],[],[],1,0,2,[],[],https://twitter.com/friedberg/status/1240715492089724928,False,,0,,,,,,,"[{'user_id': '16359535', 'username': 'friedberg'}]",,,,
1240715491296948224,1240715489929621506,1584644599000,2020-03-20,00:33:19,IST,16359535,friedberg,david friedberg,,"social isolation is saving lives.. we can even estimate how many  - Imperial College says up to 2M, but may be much less (<100k?) if key assumptions are off, even by a little bit; we aren't, however, hearing many numbers about the human cost of the economic damage of the shutdown",[],[],[],3,1,5,[],[],https://twitter.com/friedberg/status/1240715491296948224,False,,0,,,,,,,"[{'user_id': '16359535', 'username': 'friedberg'}]",,,,
1240715489929621506,1240715489929621506,1584644598000,2020-03-20,00:33:18,IST,16359535,friedberg,david friedberg,,"48% of Americans work for themselves or small local businesses (<10 employees),  10% work in restaurant industry, 5% in travel industry, 4% in energy industry, 3% in retail sales.. some overlap, but likely 2/3 of American jobs are at risk by our active shutdown",[],[],[],1,10,26,[],[],https://twitter.com/friedberg/status/1240715489929621506,False,,0,,,,,,,"[{'user_id': '16359535', 'username': 'friedberg'}]",,,,
1240703055156277249,1240703052895535105,1584641634000,2020-03-19,23:43:54,IST,16359535,friedberg,david friedberg,,"""Early results from deCode Genetics indicate that a low proportion of the general population has contracted the virus and that about half of those who tested positive are non-symptomatic,”  “The other half displays very moderate cold-like symptoms."" https://www.buzzfeed.com/albertonardelli/coronavirus-testing-iceland …",[],['https://www.buzzfeed.com/albertonardelli/coronavirus-testing-iceland'],[],6,21,99,[],[],https://twitter.com/friedberg/status/1240703055156277249,False,,0,,,,,,,"[{'user_id': '16359535', 'username': 'friedberg'}]",,,,
1240703054334144512,1240703052895535105,1584641633000,2020-03-19,23:43:53,IST,16359535,friedberg,david friedberg,,"if most people are asymptomatic and the virus is much more prevalent than we currently assume, we could have a lower R0 and a lower case fatality rate and may want to reconsider our public policy actions",[],[],[],12,13,145,[],[],https://twitter.com/friedberg/status/1240703054334144512,False,,0,,,,,,,"[{'user_id': '16359535', 'username': 'friedberg'}]",,,,
1240703053591793664,1240703052895535105,1584641633000,2020-03-19,23:43:53,IST,16359535,friedberg,david friedberg,,iceland found that 1% of the general population is positive for COVID-19. 50% of them are asymptomatic and the other 50% have a mild to moderate cold. this is another data point to validate that we need to do similar broad testing in the US. (these are high sensitivity tests),[],[],[],14,41,180,[],[],https://twitter.com/friedberg/status/1240703053591793664,False,,0,,,,,,,"[{'user_id': '16359535', 'username': 'friedberg'}]",,,,
1240703052895535105,1240703052895535105,1584641633000,2020-03-19,23:43:53,IST,16359535,friedberg,david friedberg,,"iceland has tested 10.4 people per 1,000 of their population - nearly double the rate of korea and the highest rate in the world. they started general population voluntary testing on friday",[],[],[],41,133,523,[],[],https://twitter.com/friedberg/status/1240703052895535105,False,,0,,,,,,,"[{'user_id': '16359535', 'username': 'friedberg'}]",,,,
1240664210536722433,1240664210536722433,1584632372000,2020-03-19,21:09:32,IST,16359535,friedberg,david friedberg,,The Great Panic,[],[],[],1,1,21,[],[],https://twitter.com/friedberg/status/1240664210536722433,False,,0,,,,,,,"[{'user_id': '16359535', 'username': 'friedberg'}]",,,,
1240396969253703680,1240396969253703680,1584568657000,2020-03-19,03:27:37,IST,16359535,friedberg,david friedberg,,"unfortunately this data is scary for nyc hospital system. while the increase in respiratory cases can be explained as psychosomatic (coronavirus mania making everyone think they’re sick), the pneumonia admissions data is a real indicator of a spike coming  https://www1.nyc.gov/assets/doh/downloads/pdf/imm/covid-19-syndromic-surveillance.pdf … pic.twitter.com/cwwrIBTmXI",[],['https://www1.nyc.gov/assets/doh/downloads/pdf/imm/covid-19-syndromic-surveillance.pdf'],['https://pbs.twimg.com/media/ETbGdtNUUAAnFny.jpg'],3,5,18,[],[],https://twitter.com/friedberg/status/1240396969253703680,False,,0,,,,,,,"[{'user_id': '16359535', 'username': 'friedberg'}]",,,,
1240375777733967872,1240375777733967872,1584563605000,2020-03-19,02:03:25,IST,16359535,friedberg,david friedberg,,discussion w charles chiu at ucsf... he estimates total fatality rate under 2.0% due to under-testing https://www.ucsf.edu/news/2020/02/416671/how-new-coronavirus-spreads-and-progresses-and-why-one-test-may-not-be-enough …,[],['https://www.ucsf.edu/news/2020/02/416671/how-new-coronavirus-spreads-and-progresses-and-why-one-test-may-not-be-enough'],[],5,7,16,[],[],https://twitter.com/friedberg/status/1240375777733967872,False,,0,,,,,,,"[{'user_id': '16359535', 'username': 'friedberg'}]",,,,
1240334545934675969,1240228201777049601,1584553774000,2020-03-18,23:19:34,IST,16359535,friedberg,david friedberg,,"these are also cumulative confirmed cases,  not active cases",['davidasinclair'],[],[],0,0,4,[],[],https://twitter.com/friedberg/status/1240334545934675969,False,,0,,,,,,,"[{'user_id': '16359535', 'username': 'friedberg'}, {'user_id': '520445177', 'username': 'davidasinclair'}]",,,,
1240334194120650752,1240334189406203909,1584553690000,2020-03-18,23:18:10,IST,16359535,friedberg,david friedberg,,"amidst these decisions we have to be mindful about food security .. closing down food production facilities/factories, where most humans get most of their calories, needed for survival, is a major catastrophic risk. these precedents are dangerous",[],[],[],2,2,19,[],[],https://twitter.com/friedberg/status/1240334194120650752,False,,0,,,,,,,"[{'user_id': '16359535', 'username': 'friedberg'}]",,,,
1240334190677094400,1240334189406203909,1584553690000,2020-03-18,23:18:10,IST,16359535,friedberg,david friedberg,,but Ford GM and other auto manufacturers just stopped production in all factories over concerns for workers safety amid coronavirus outbreak,[],[],[],1,1,8,[],[],https://twitter.com/friedberg/status/1240334190677094400,False,,0,,,,,,,"[{'user_id': '16359535', 'username': 'friedberg'}]",,,,
1240334189406203909,1240334189406203909,1584553689000,2020-03-18,23:18:09,IST,16359535,friedberg,david friedberg,,"i’ve said it publicly before - the world runs on a 30-day food supply. if the system of food production grinds to a halt, we’re in trouble.. there’s only 30 days of food based on current calories consumed per day. it’s never been considered a relevant stat before",[],[],[],4,15,55,[],[],https://twitter.com/friedberg/status/1240334189406203909,False,,0,,,,,,,"[{'user_id': '16359535', 'username': 'friedberg'}]",,,,
1240331585406111745,1240331570491211776,1584553068000,2020-03-18,23:07:48,IST,16359535,friedberg,david friedberg,,"such a model can take in not just pos test result data (biased, delayed, and only partially reported) but can include ICU beds available, broad gen pop antibody testing data, flu symptom reporting data etc. and adjust based on actual data that can have major effects on forecasts",[],[],[],1,0,5,[],[],https://twitter.com/friedberg/status/1240331585406111745,False,,0,,,,,,,"[{'user_id': '16359535', 'username': 'friedberg'}]",,,,
1240331584063942657,1240331570491211776,1584553068000,2020-03-18,23:07:48,IST,16359535,friedberg,david friedberg,,some gov agency or private party should be publishing a continuous model that produces a simulation of covid outbreak prediction scenarios (and associated probability of each) using new data every day,[],[],[],1,1,7,[],[],https://twitter.com/friedberg/status/1240331584063942657,False,,0,,,,,,,"[{'user_id': '16359535', 'username': 'friedberg'}]",,,,
1240331582822465542,1240331570491211776,1584553068000,2020-03-18,23:07:48,IST,16359535,friedberg,david friedberg,,such models are often viewed as deterministic (this is what’s going to happen) and only at a point in time (the forecast doesn’t change). the reality is these models are probabilistic (create a range of different outcomes) and are dynamic (change all the time with new data),[],[],[],1,0,0,[],[],https://twitter.com/friedberg/status/1240331582822465542,False,,0,,,,,,,"[{'user_id': '16359535', 'username': 'friedberg'}]",,,,
1240331581333458944,1240331570491211776,1584553067000,2020-03-18,23:07:47,IST,16359535,friedberg,david friedberg,,the imperial college model should not be treated as a static predictor.. it uses a range of assumptions and doesn’t have other potentially important variables,[],[],[],3,0,2,[],[],https://twitter.com/friedberg/status/1240331581333458944,False,,0,,,,,,,"[{'user_id': '16359535', 'username': 'friedberg'}]",,,,
1240331578770771969,1240331570491211776,1584553067000,2020-03-18,23:07:47,IST,16359535,friedberg,david friedberg,,"there are other variables that aren’t modeled like distribution of A1c, which may be a key driver of outcome/severity in covid-19 ( https://twitter.com/davidasinclair/status/1238972082756648960?s=21 …)",[],['https://twitter.com/davidasinclair/status/1238972082756648960?s=21'],[],2,0,1,[],[],https://twitter.com/friedberg/status/1240331578770771969,False,https://twitter.com/davidasinclair/status/1238972082756648960,0,,,,,,,"[{'user_id': '16359535', 'username': 'friedberg'}]",,,,
1240331575373336577,1240331570491211776,1584553066000,2020-03-18,23:07:46,IST,16359535,friedberg,david friedberg,,"it also highlights that certain assumptions, like R0 can have a massively varied outcome, and it doesn’t clearly adjust asymptomatic patient %ile, which we also don’t clearly know and could also massively change outcomes",[],[],[],1,0,0,[],[],https://twitter.com/friedberg/status/1240331575373336577,False,,0,,,,,,,"[{'user_id': '16359535', 'username': 'friedberg'}]",,,,
1240331574010241024,1240331570491211776,1584553066000,2020-03-18,23:07:46,IST,16359535,friedberg,david friedberg,,"the imperial college paper ( https://www.imperial.ac.uk/media/imperial-college/medicine/sph/ide/gida-fellowships/Imperial-College-COVID19-NPI-modelling-16-03-2020.pdf …) provides a rather bleak outlook, scenario analysis, and mitigation techniques that seem reasonable based on the modeled outlook",[],['https://www.imperial.ac.uk/media/imperial-college/medicine/sph/ide/gida-fellowships/Imperial-College-COVID19-NPI-modelling-16-03-2020.pdf'],[],1,0,0,[],[],https://twitter.com/friedberg/status/1240331574010241024,False,,0,,,,,,,"[{'user_id': '16359535', 'username': 'friedberg'}]",,,,
1240331572160507910,1240331570491211776,1584553065000,2020-03-18,23:07:45,IST,16359535,friedberg,david friedberg,,"if you work in finance, one way to relate is that these models behave like a DCF model.. if you make slight changes in the terminal growth rate or WACC, you can multiply valuations or reduce them to fractions",[],[],[],1,0,0,[],[],https://twitter.com/friedberg/status/1240331572160507910,False,,0,,,,,,,"[{'user_id': '16359535', 'username': 'friedberg'}]",,,,
1240331570491211776,1240331570491211776,1584553065000,2020-03-18,23:07:45,IST,16359535,friedberg,david friedberg,,nasim taleb highlights how sensitive epidemiological models are to slight changes in variables... you can produce massively divergent outcomes https://twitter.com/nntaleb/status/1239171413342289921?s=21 …,[],['https://twitter.com/nntaleb/status/1239171413342289921?s=21'],[],1,0,8,[],[],https://twitter.com/friedberg/status/1240331570491211776,False,https://twitter.com/nntaleb/status/1239171413342289921,0,,,,,,,"[{'user_id': '16359535', 'username': 'friedberg'}]",,,,
1240121091059789824,1240121076820201473,1584502883000,2020-03-18,09:11:23,IST,16359535,friedberg,david friedberg,,"given the possibility of efficacy and the scale of the covid-19 pandemic, this drug should be immediately scaled in production and made broadly available under a right-to-try mandate .. let doctors and patients decide",[],[],[],9,17,93,[],[],https://twitter.com/friedberg/status/1240121091059789824,False,,0,,,,,,,"[{'user_id': '16359535', 'username': 'friedberg'}]",,,,
1240121089981911043,1240121076820201473,1584502882000,2020-03-18,09:11:22,IST,16359535,friedberg,david friedberg,,"remdesivir, another promising antiviral, is also not widely available and is only available to patients in the US under a compassionate use application..",[],[],[],1,3,31,[],[],https://twitter.com/friedberg/status/1240121089981911043,False,,0,,,,,,,"[{'user_id': '16359535', 'username': 'friedberg'}]",,,,
1240121088958488577,1240121076820201473,1584502882000,2020-03-18,09:11:22,IST,16359535,friedberg,david friedberg,,the CDC/FDA should let doctors and patients decide if they want to use these drugs and ensure their broad availability (several care providers have told me they can not get prescriptions for chloroquine filled in the bay area),[],[],[],1,5,24,[],[],https://twitter.com/friedberg/status/1240121088958488577,False,,0,,,,,,,"[{'user_id': '16359535', 'username': 'friedberg'}]",,,,
1240121087909912576,1240121076820201473,1584502882000,2020-03-18,09:11:22,IST,16359535,friedberg,david friedberg,,"in the absence of any treatment alternative whatsoever, the CDC should consider making the reco to care providers to consider the Korea protocol in treatment..and make supplies of chloroquine + Kaletra antivirals widely available through mandates to producers & distributors asap",[],[],[],1,10,43,[],[],https://twitter.com/friedberg/status/1240121087909912576,False,,0,,,,,,,"[{'user_id': '16359535', 'username': 'friedberg'}]",,,,
1240121086609698817,1240121076820201473,1584502882000,2020-03-18,09:11:22,IST,16359535,friedberg,david friedberg,,"currently, the CDC website ( https://www.cdc.gov/coronavirus/2019-ncov/hcp/clinical-guidance-management-patients.html …) tells care providers there is no known treatment ... there is no mention of chloroquine or kaletra (antiviral used in korea)",[],['https://www.cdc.gov/coronavirus/2019-ncov/hcp/clinical-guidance-management-patients.html'],[],1,8,37,[],[],https://twitter.com/friedberg/status/1240121086609698817,False,,0,,,,,,,"[{'user_id': '16359535', 'username': 'friedberg'}]",,,,
1240121085460385792,1240121076820201473,1584502881000,2020-03-18,09:11:21,IST,16359535,friedberg,david friedberg,,"chloroquine, especially, is a well-studied drug and has a known safety profile. the apparent efficacy and adoption of its use in china, korea, and italy suggests we should consider it for treatment in the US. we don’t recommend it bc we haven’t conducted blinded clinical trials",[],[],[],3,5,31,[],[],https://twitter.com/friedberg/status/1240121085460385792,False,,0,,,,,,,"[{'user_id': '16359535', 'username': 'friedberg'}]",,,,
1240121083744919552,1240121076820201473,1584502881000,2020-03-18,09:11:21,IST,16359535,friedberg,david friedberg,,chloroquine’s apparent efficacy is highlighted in several papers:  https://www.jstage.jst.go.jp/article/bst/14/1/14_2020.01047/_article … https://www.sciencedirect.com/science/article/pii/S0924857920300662?via%3Dihub …,[],"['https://www.jstage.jst.go.jp/article/bst/14/1/14_2020.01047/_article', 'https://www.sciencedirect.com/science/article/pii/S0924857920300662?via%3Dihub']",[],3,13,40,[],[],https://twitter.com/friedberg/status/1240121083744919552,False,,0,,,,,,,"[{'user_id': '16359535', 'username': 'friedberg'}]",,,,
1240121082302156812,1240121076820201473,1584502881000,2020-03-18,09:11:21,IST,16359535,friedberg,david friedberg,,"as a result of widespread testing, containment, and the adoption of their treatment protocol, south korea is seeing the lowest fatality rate of any country with major outbreak  https://www.worldometers.info/coronavirus/ ",[],['https://www.worldometers.info/coronavirus/'],[],1,8,46,[],[],https://twitter.com/friedberg/status/1240121082302156812,False,,0,,,,,,,"[{'user_id': '16359535', 'username': 'friedberg'}]",,,,
1240121076820201473,1240121076820201473,1584502879000,2020-03-18,09:11:19,IST,16359535,friedberg,david friedberg,,"we should also be optimistic on treatment for covid-19. korean doctors created a protocol for treatment using antivirals and chloroquine, drugs which are widely available and affordable.  https://www.elsevier.com/__data/assets/pdf_file/0007/988648/COVID-19-Drug-Therapy_Mar-2020.pdf …",[],['https://www.elsevier.com/__data/assets/pdf_file/0007/988648/COVID-19-Drug-Therapy_Mar-2020.pdf'],[],15,112,417,[],[],https://twitter.com/friedberg/status/1240121076820201473,False,,0,,,,,,,"[{'user_id': '16359535', 'username': 'friedberg'}]",,,,
1240105771477524480,1240105771477524480,1584499230000,2020-03-18,08:10:30,IST,16359535,friedberg,david friedberg,,"to be clear, i am NOT anti-containment. i am simply optimistic and try to be data-driven. i want us all to ask questions and answer them with data and facts. everyone freaking out and spiraling and spinning anecdote into fact is generally just bad",[],[],[],4,5,69,[],[],https://twitter.com/friedberg/status/1240105771477524480,False,,0,,,,,,,"[{'user_id': '16359535', 'username': 'friedberg'}]",,,,
1240103955251654656,1240101746648612864,1584498797000,2020-03-18,08:03:17,IST,16359535,friedberg,david friedberg,,"1) mortality rate much higher for older population (see pic)
2) italy 5th oldest country in world  https://worldpopulationreview.com/countries/median-age/ … 3) large % over 65 2.3x china  https://worldpopulationreview.com/countries/median-age/ … 4) ICU beds per capita may be low relative to US  https://www.forbes.com/sites/niallmccarthy/2020/03/12/the-countries-with-the-most-critical-care-beds-per-capita-infographic/ … all compounding factors pic.twitter.com/P6sqE8Cv9Y",['jharinstein'],"['https://worldpopulationreview.com/countries/median-age/', 'https://worldpopulationreview.com/countries/median-age/', 'https://www.forbes.com/sites/niallmccarthy/2020/03/12/the-countries-with-the-most-critical-care-beds-per-capita-infographic/']",['https://pbs.twimg.com/media/ETW7-TMU0AAmauG.jpg'],1,5,15,[],[],https://twitter.com/friedberg/status/1240103955251654656,False,,0,,,,,,,"[{'user_id': '16359535', 'username': 'friedberg'}, {'user_id': '16362641', 'username': 'jharinstein'}]",,,,
1240101932963737600,1240041812116434944,1584498315000,2020-03-18,07:55:15,IST,16359535,friedberg,david friedberg,,see next tweet. not sure how much pressure we’re really seeing. data doesn’t support it,['enchantedmeat'],[],[],0,0,1,[],[],https://twitter.com/friedberg/status/1240101932963737600,False,,0,,,,,,,"[{'user_id': '16359535', 'username': 'friedberg'}, {'user_id': '1108566836461723648', 'username': 'EnchantedMeat'}]",,,,
1240101764260442112,1240101746648612864,1584498275000,2020-03-18,07:54:35,IST,16359535,friedberg,david friedberg,,"bay area, LA, and NYC hospitals setup overflow ICU tents last week and the week before. we were expecting to use them. it seems we aren’t yet and containment only started yesterday. do we have the data/model wrong? we should be answering this question as a priority right now",[],[],[],32,13,222,[],[],https://twitter.com/friedberg/status/1240101764260442112,False,,0,,,,,,,"[{'user_id': '16359535', 'username': 'friedberg'}]",,,,
1240101763518050304,1240101746648612864,1584498275000,2020-03-18,07:54:35,IST,16359535,friedberg,david friedberg,,"5) generally, symptoms aren’t bad enough to warrant hospital visit (why? age? we need broad sampling and interviewing to know, not just anecdotal already-severely-ill data)",[],[],[],8,6,105,[],[],https://twitter.com/friedberg/status/1240101763518050304,False,,0,,,,,,,"[{'user_id': '16359535', 'username': 'friedberg'}]",,,,
1240101762842804224,1240101746648612864,1584498274000,2020-03-18,07:54:34,IST,16359535,friedberg,david friedberg,,3) hasn’t been long enough to see an explosion due to incubation (unlikely due to starting count and data on incubation from elsewhere) 4) many more patients are asymptomatic - the average age in seattle is 35 and symptoms are non-linear with age (possible.. see previous tweet),[],[],[],4,10,112,[],[],https://twitter.com/friedberg/status/1240101762842804224,False,,0,,,,,,,"[{'user_id': '16359535', 'username': 'friedberg'}]",,,,
1240101762180079616,1240101746648612864,1584498274000,2020-03-18,07:54:34,IST,16359535,friedberg,david friedberg,,several possible explanations... 1) social isolation happened fast enough (not likely as people were in groups in seattle yday) 2) the virus is not that viral (unlikely - lots of data to counter this),[],[],[],3,6,117,[],[],https://twitter.com/friedberg/status/1240101762180079616,False,,0,,,,,,,"[{'user_id': '16359535', 'username': 'friedberg'}]",,,,
1240101761500635136,1240101746648612864,1584498274000,2020-03-18,07:54:34,IST,16359535,friedberg,david friedberg,,"no one is asking and investigating “why?”.. despite no isolation policy and a high positive count two weeks ago in seattle. why are there still ventilators and ICU beds available, and why are daily positive results static (despite an R0 of 2.5)?",[],[],[],7,13,130,[],[],https://twitter.com/friedberg/status/1240101761500635136,False,,0,,,,,,,"[{'user_id': '16359535', 'username': 'friedberg'}]",,,,
1240101760762384385,1240101746648612864,1584498274000,2020-03-18,07:54:34,IST,16359535,friedberg,david friedberg,,despite increasing testing capacity 10x over two weeks positive test results have held steady at <100 per day. the expectation has been for an explosion in cases based on lack of containment but the data doesn’t seem to indicate an expected growth in positive cases,[],[],[],13,23,249,[],[],https://twitter.com/friedberg/status/1240101760762384385,False,,0,,,,,,,"[{'user_id': '16359535', 'username': 'friedberg'}]",,,,
