id,conversation_id,created_at,date,time,timezone,user_id,username,name,place,tweet,mentions,urls,photos,replies_count,retweets_count,likes_count,hashtags,cashtags,link,retweet,quote_url,video,near,geo,source,user_rt_id,user_rt,retweet_id,reply_to,retweet_date,translate,trans_src,trans_dest
1241039634676629504,1241039634676629504,1584721880000,2020-03-20,16:31:20,IST,7166802,jodawi,Jodawi,,"""The best lack all conviction, while the worst
Are full of passionate intensity"" ... it occurs to me that this is because destruction is straightforward and easy, and creation takes thought and is hard.",[],[],[],0,0,0,[],[],https://twitter.com/jodawi/status/1241039634676629504,False,,0,,,,,,,"[{'user_id': '7166802', 'username': 'jodawi'}]",,,,
1240363932176363523,1240363932176363523,1584560780000,2020-03-18,19:46:20,IST,7166802,jodawi,Jodawi,,In what decade will printers start being able to reliably connect to networks? Asking for a document that needs to go out today.,[],[],[],0,0,2,[],[],https://twitter.com/jodawi/status/1240363932176363523,False,,0,,,,,,,"[{'user_id': '7166802', 'username': 'jodawi'}]",,,,
1239669621738754054,1239668852952195072,1584395244000,2020-03-16,21:47:24,IST,7166802,jodawi,Jodawi,,Purt much,['beaq'],[],[],0,0,0,[],[],https://twitter.com/jodawi/status/1239669621738754054,False,,0,,,,,,,"[{'user_id': '7166802', 'username': 'jodawi'}, {'user_id': '3170651', 'username': 'beaq'}]",,,,
1239639008310734848,1239560855043428352,1584387945000,2020-03-16,19:45:45,IST,7166802,jodawi,Jodawi,,"Janufeb 37, 1492. I am slowly but surely losing my mind.",['imjasondiamond'],[],[],0,0,0,[],[],https://twitter.com/jodawi/status/1239639008310734848,False,,0,,,,,,,"[{'user_id': '7166802', 'username': 'jodawi'}, {'user_id': '18771658', 'username': 'imjasondiamond'}]",,,,
1239585402224164866,1239585402224164866,1584375164000,2020-03-16,16:12:44,IST,7166802,jodawi,Jodawi,, https://www.reddit.com/r/neoliberal/comments/fj5go3/theres_no_exit_poll_discrepancy_a_deep_dive_into/?utm_medium=android_app&utm_source=share …,[],['https://www.reddit.com/r/neoliberal/comments/fj5go3/theres_no_exit_poll_discrepancy_a_deep_dive_into/?utm_medium=android_app&utm_source=share'],[],0,0,0,[],[],https://twitter.com/jodawi/status/1239585402224164866,False,,0,,,,,,,"[{'user_id': '7166802', 'username': 'jodawi'}]",,,,
1237740458442285056,1237722612253339649,1583935296000,2020-03-11,14:01:36,IST,7166802,jodawi,Jodawi,,"1. Martial law due to coronovirus threat - election cancelled. Or, 2. Pence claims widespread Dem vot fraud, refuses to validate electoral college vote, ""contingent election"" chooses Trump as election winner.",['hnturtledove'],[],[],2,0,1,[],[],https://twitter.com/jodawi/status/1237740458442285056,False,,0,,,,,,,"[{'user_id': '7166802', 'username': 'jodawi'}, {'user_id': '842029626608123904', 'username': 'HNTurtledove'}]",,,,
1237613347563958273,1237613347563958273,1583904990000,2020-03-11,05:36:30,IST,7166802,jodawi,Jodawi,,"It was nice believing for a while that maybe we could have nice sane things like the developed world has. But no, we demand all the evils. Guess I'll go warm myself with the $85,000 of student loans I still have 30 years after leaving school.",[],[],[],0,0,0,[],[],https://twitter.com/jodawi/status/1237613347563958273,False,,0,,,,,,,"[{'user_id': '7166802', 'username': 'jodawi'}]",,,,
1237581630283243520,1237581630283243520,1583897428000,2020-03-11,03:30:28,IST,7166802,jodawi,Jodawi,,"Two things I don't understand about this batshit-crazy country: why many Republicans hated the Clintons, and why many Democrats hate Sanders.",[],[],[],0,0,0,[],[],https://twitter.com/jodawi/status/1237581630283243520,False,,0,,,,,,,"[{'user_id': '7166802', 'username': 'jodawi'}]",,,,
1237020055075819523,1236972864835932160,1583763538000,2020-03-09,14:18:58,IST,7166802,jodawi,Jodawi,,❤,['toofrank'],[],[],0,0,0,[],[],https://twitter.com/jodawi/status/1237020055075819523,False,,0,,,,,,,"[{'user_id': '7166802', 'username': 'jodawi'}, {'user_id': '4777661', 'username': 'toofrank'}]",,,,
1236812821494517760,1236764632909524997,1583714130000,2020-03-09,00:35:30,IST,7166802,jodawi,Jodawi,,❤,['kimster_giggles'],[],[],1,0,1,[],[],https://twitter.com/jodawi/status/1236812821494517760,False,,0,,,,,,,"[{'user_id': '7166802', 'username': 'jodawi'}, {'user_id': '797098900184334337', 'username': 'kimster_giggles'}]",,,,
1236811386560196609,1236811386560196609,1583713788000,2020-03-09,00:29:48,IST,7166802,jodawi,Jodawi,,"I assume @ewarren  is waiting to endorse @BernieSanders  until a strategic moment, to blunt the next centrist endorsement of Biden","['ewarren', 'berniesanders']",[],[],0,0,0,[],[],https://twitter.com/jodawi/status/1236811386560196609,False,,0,,,,,,,"[{'user_id': '7166802', 'username': 'jodawi'}, {'user_id': '357606935', 'username': 'ewarren'}, {'user_id': '216776631', 'username': 'BernieSanders'}]",,,,
1235972600624484353,1235972600624484353,1583513805000,2020-03-06,16:56:45,IST,7166802,jodawi,Jodawi,,"I want to know where @ewarren, 2 decades older than me, gets all her energy.",['ewarren'],[],[],0,0,1,[],[],https://twitter.com/jodawi/status/1235972600624484353,False,,0,,,,,,,"[{'user_id': '7166802', 'username': 'jodawi'}, {'user_id': '357606935', 'username': 'ewarren'}]",,,,
1235625594760527872,1235625594760527872,1583431073000,2020-03-05,17:57:53,IST,7166802,jodawi,Jodawi,,Absolutely. But only after it somehow magically becomes not a hoax. https://twitter.com/TeaPainUSA/status/1235557454865248256 …,[],['https://twitter.com/TeaPainUSA/status/1235557454865248256'],[],0,0,0,[],[],https://twitter.com/jodawi/status/1235625594760527872,False,https://twitter.com/TeaPainUSA/status/1235557454865248256,0,,,,,,,"[{'user_id': '7166802', 'username': 'jodawi'}]",,,,
1235614624306868227,1235614624306868227,1583428457000,2020-03-05,17:14:17,IST,7166802,jodawi,Jodawi,,Lots of tech workers switching to full-time work from home. Wonder how long until there's layoffs for the non-tech support people like food service and janitorial.,[],[],[],0,0,0,[],[],https://twitter.com/jodawi/status/1235614624306868227,False,,0,,,,,,,"[{'user_id': '7166802', 'username': 'jodawi'}]",,,,
1235404307018575873,1235404307018575873,1583378314000,2020-03-05,03:18:34,IST,7166802,jodawi,Jodawi,,"So what if all the septuagenarian candidates die of covid, including Trump - who gets elected?",[],[],[],1,0,0,[],[],https://twitter.com/jodawi/status/1235404307018575873,False,,0,,,,,,,"[{'user_id': '7166802', 'username': 'jodawi'}]",,,,
1235393848278302722,1235393848278302722,1583375820000,2020-03-05,02:37:00,IST,7166802,jodawi,Jodawi,,How old would Paul Wellstone have been if he hadn't been assassinated?,[],[],[],0,0,0,[],[],https://twitter.com/jodawi/status/1235393848278302722,False,,0,,,,,,,"[{'user_id': '7166802', 'username': 'jodawi'}]",,,,
1235289011951996934,1235289011951996934,1583350825000,2020-03-04,19:40:25,IST,7166802,jodawi,Jodawi,,"Attn everyone: you can now drop the ""novel"" part of ""novel coronavirus""",[],[],[],1,0,2,[],[],https://twitter.com/jodawi/status/1235289011951996934,False,,0,,,,,,,"[{'user_id': '7166802', 'username': 'jodawi'}]",,,,
1235131189951787008,1235131189951787008,1583313197000,2020-03-04,09:13:17,IST,7166802,jodawi,Jodawi,,This is the #1 scary thing https://twitter.com/spettypi/status/1234969189321973760 …,[],['https://twitter.com/spettypi/status/1234969189321973760'],[],0,0,0,[],[],https://twitter.com/jodawi/status/1235131189951787008,False,https://twitter.com/spettypi/status/1234969189321973760,0,,,,,,,"[{'user_id': '7166802', 'username': 'jodawi'}]",,,,
1235126921211461633,1234904289660698624,1583312180000,2020-03-04,08:56:20,IST,7166802,jodawi,Jodawi,,Phaya Thai,['ericacbarnett'],[],[],0,0,0,[],[],https://twitter.com/jodawi/status/1235126921211461633,False,,0,,,,,,,"[{'user_id': '7166802', 'username': 'jodawi'}, {'user_id': '29819203', 'username': 'ericacbarnett'}]",,,,
1235082095195639809,1235082095195639809,1583301492000,2020-03-04,05:58:12,IST,7166802,jodawi,Jodawi,,"Everyone: ""I'd rather elect a cheese sandwich than Trump."" Biden: dumps Cheez Whiz on his head. Everyone: ""Close enough!""",[],[],[],0,0,0,[],[],https://twitter.com/jodawi/status/1235082095195639809,False,,0,,,,,,,"[{'user_id': '7166802', 'username': 'jodawi'}]",,,,
1235033915464642562,1235033915464642562,1583290005000,2020-03-04,02:46:45,IST,7166802,jodawi,Jodawi,,I must look like I'm pondering how many friends and family are likely to die from pandemic because people keep asking me if I'm ok. Contemplating searching for telecommuting software engineering jobs.,[],[],[],0,0,0,[],[],https://twitter.com/jodawi/status/1235033915464642562,False,,0,,,,,,,"[{'user_id': '7166802', 'username': 'jodawi'}]",,,,
1234997457487949824,1234997457487949824,1583281313000,2020-03-04,00:21:53,IST,7166802,jodawi,Jodawi,,"Sociopaths always see death and despair as opportunities. To identify sociopaths over the coming year, see who tries to profit from the pandemic, the looming global recession, etc., instead of trying to help. https://twitter.com/SenWarren/status/1234947171482587136 …",[],['https://twitter.com/SenWarren/status/1234947171482587136'],[],0,1,2,[],[],https://twitter.com/jodawi/status/1234997457487949824,False,https://twitter.com/SenWarren/status/1234947171482587136,0,,,,,,,"[{'user_id': '7166802', 'username': 'jodawi'}]",,,,
1234718977135235072,1234718977135235072,1583214918000,2020-03-03,05:55:18,IST,7166802,jodawi,Jodawi,, https://www.thenation.com/article/archive/biden-2020-trump-nafta/ …,[],['https://www.thenation.com/article/archive/biden-2020-trump-nafta/'],[],0,0,0,[],[],https://twitter.com/jodawi/status/1234718977135235072,False,,0,,,,,,,"[{'user_id': '7166802', 'username': 'jodawi'}]",,,,
1233954075357536256,1233821102268280832,1583032551000,2020-03-01,03:15:51,IST,7166802,jodawi,Jodawi,,At least some do.,['apestyle'],[],[],0,0,0,[],[],https://twitter.com/jodawi/status/1233954075357536256,False,,0,,,,,,,"[{'user_id': '7166802', 'username': 'jodawi'}, {'user_id': '107144900', 'username': 'apestyle'}]",,,,
1233102796238385153,1233102796238385153,1582829591000,2020-02-27,18:53:11,IST,7166802,jodawi,Jodawi,,"I looked at the markets a few weeks ago and at the time it looked like they would keep up the long-term hubris until sometime in the year after the election, which would be interpreted as a problem with Trump's successor's policies. 
""🎶Always look on the bright side of death🎶""?",[],[],[],0,0,1,[],[],https://twitter.com/jodawi/status/1233102796238385153,False,,0,,,,,,,"[{'user_id': '7166802', 'username': 'jodawi'}]",,,,
1233101164675137536,1233101164675137536,1582829202000,2020-02-27,18:46:42,IST,7166802,jodawi,Jodawi,,"Just like his reality TV show, but now everyone is an unpaid actor. https://twitter.com/brhodes/status/1233012478336012288 …",[],['https://twitter.com/brhodes/status/1233012478336012288'],[],0,0,0,[],[],https://twitter.com/jodawi/status/1233101164675137536,False,https://twitter.com/brhodes/status/1233012478336012288,0,,,,,,,"[{'user_id': '7166802', 'username': 'jodawi'}]",,,,
1232560084330303488,1231601904184066051,1582700198000,2020-02-26,06:56:38,IST,7166802,jodawi,Jodawi,,"I take it to be Intelligence Community, but was agreeing mostly with the general concept","['swhobbit', 'asharangappa_']",[],[],0,0,0,[],[],https://twitter.com/jodawi/status/1232560084330303488,False,,0,,,,,,,"[{'user_id': '7166802', 'username': 'jodawi'}, {'user_id': '18467337', 'username': 'swhobbit'}, {'user_id': '510464011', 'username': 'AshaRangappa_'}]",,,,
1231653723702562816,1231653723702562816,1582484105000,2020-02-23,18:55:05,IST,7166802,jodawi,Jodawi,,So does Sanders as Prez make for actual positive progress on Palestinian rights? Kind of hard to paint him as anti-Semitic.,[],[],[],0,0,0,[],[],https://twitter.com/jodawi/status/1231653723702562816,False,,0,,,,,,,"[{'user_id': '7166802', 'username': 'jodawi'}]",,,,
1231644102619385861,1231644102619385861,1582481811000,2020-02-23,18:16:51,IST,7166802,jodawi,Jodawi,,"They want chaos and discord, and often support opposing sides simultaneously. Don't like it? Get rid of the Republicans blocking election security bills, starting with #MoscowMitch https://twitter.com/HillBeverlyhill/status/1231603590655074306 …",[],['https://twitter.com/HillBeverlyhill/status/1231603590655074306'],[],0,0,0,['#moscowmitch'],[],https://twitter.com/jodawi/status/1231644102619385861,False,https://twitter.com/HillBeverlyhill/status/1231603590655074306,0,,,,,,,"[{'user_id': '7166802', 'username': 'jodawi'}]",,,,
1231428757115654145,1231362079157714944,1582430469000,2020-02-23,04:01:09,IST,7166802,jodawi,Jodawi,,He kept quiet because that's what you're supposed to do when information is Classified.,"['jayandsteve', 'politicususa']",[],[],0,0,0,[],[],https://twitter.com/jodawi/status/1231428757115654145,False,,0,,,,,,,"[{'user_id': '7166802', 'username': 'jodawi'}, {'user_id': '45627569', 'username': 'JayandSteve'}, {'user_id': '14792049', 'username': 'politicususa'}]",,,,
1231426522503757825,1231375752379039745,1582429936000,2020-02-23,03:52:16,IST,7166802,jodawi,Jodawi,,You're either a troll or misguided. Things like this damage Bernie's campaign.,"['crelto', 'krystalball']",[],[],2,0,0,[],[],https://twitter.com/jodawi/status/1231426522503757825,False,,0,,,,,,,"[{'user_id': '7166802', 'username': 'jodawi'}, {'user_id': '23171733', 'username': 'crelto'}, {'user_id': '21862217', 'username': 'krystalball'}]",,,,
1231423682209181699,1231423682209181699,1582429259000,2020-02-23,03:40:59,IST,7166802,jodawi,Jodawi,,Anyone fluent in Latin available for a short phrase?,[],[],[],0,0,1,[],[],https://twitter.com/jodawi/status/1231423682209181699,False,,0,,,,,,,"[{'user_id': '7166802', 'username': 'jodawi'}]",,,,
1231284064272838656,1231256659441463297,1582395971000,2020-02-22,18:26:11,IST,7166802,jodawi,Jodawi,,"Trump thinks Putin is 6'7"" because he's always  on his knees looking up.","['jasonkander', 'hnturtledove']",[],[],0,0,2,[],[],https://twitter.com/jodawi/status/1231284064272838656,False,,0,,,,,,,"[{'user_id': '7166802', 'username': 'jodawi'}, {'user_id': '20744708', 'username': 'JasonKander'}, {'user_id': '842029626608123904', 'username': 'HNTurtledove'}]",,,,
1231274674966781952,1231274674966781952,1582393733000,2020-02-22,17:48:53,IST,7166802,jodawi,Jodawi,,"I voted Warren in the primary because she needs to be higher than everyone except Bernie. Now, unrelatedly, someone sell me a car that will last at least a year.",[],[],[],0,0,0,[],[],https://twitter.com/jodawi/status/1231274674966781952,False,,0,,,,,,,"[{'user_id': '7166802', 'username': 'jodawi'}]",,,,
1230734047942365187,1230734047942365187,1582264837000,2020-02-21,06:00:37,IST,7166802,jodawi,Jodawi,,"So according to twitter, Warren won the debate by reaming Bloomy with a burning brand of truth over and over. But NPR says Bernie won.",[],[],[],1,0,0,[],[],https://twitter.com/jodawi/status/1230734047942365187,False,,0,,,,,,,"[{'user_id': '7166802', 'username': 'jodawi'}]",,,,
1230732549866962944,1230534424435052544,1582264480000,2020-02-21,05:54:40,IST,7166802,jodawi,Jodawi,,Absurd! You only have one datacenter.,['tithonium'],[],[],0,0,1,[],[],https://twitter.com/jodawi/status/1230732549866962944,False,,0,,,,,,,"[{'user_id': '7166802', 'username': 'jodawi'}, {'user_id': '1547781', 'username': 'tithonium'}]",,,,
1230028920445009920,1230028920445009920,1582096722000,2020-02-19,07:18:42,IST,7166802,jodawi,Jodawi,,I would happily eat a me-burger. https://twitter.com/RichardDawkins/status/1229715325324795904 …,[],['https://twitter.com/RichardDawkins/status/1229715325324795904'],[],0,0,0,[],[],https://twitter.com/jodawi/status/1230028920445009920,False,https://twitter.com/RichardDawkins/status/1229715325324795904,0,,,,,,,"[{'user_id': '7166802', 'username': 'jodawi'}]",,,,
1230017058466942977,1230017058466942977,1582093894000,2020-02-19,06:31:34,IST,7166802,jodawi,Jodawi,,"Who I give monthly $ to now: 

Bernie Sanders @BernieSanders
Elizabeth Warren @ewarren 
Brand New Congress @BrandNew535 
Jessica Cisneros @JCisnerosTX
Alexandria Ocasio-Cortez @RepAOC 
Amy McGrath @AmyMcGrathKY
Sara Gideon @SaraGideon

& Possibly Mitt Romney, with therapy.","['berniesanders', 'ewarren', 'brandnew535', 'jcisnerostx', 'repaoc', 'amymcgrathky', 'saragideon']",[],[],1,0,3,[],[],https://twitter.com/jodawi/status/1230017058466942977,False,,0,,,,,,,"[{'user_id': '7166802', 'username': 'jodawi'}, {'user_id': '216776631', 'username': 'BernieSanders'}, {'user_id': '357606935', 'username': 'ewarren'}, {'user_id': '716435110845808641', 'username': 'BrandNew535'}, {'user_id': '1136317807954731014', 'username': 'JCisnerosTX'}, {'user_id': '1079104563280527364', 'username': 'RepAOC'}, {'user_id': '2783231383', 'username': 'AmyMcGrathKY'}, {'user_id': '1139607716941500417', 'username': 'SaraGideon'}]",,,,
1230004743251980288,1230004743251980288,1582090957000,2020-02-19,05:42:37,IST,7166802,jodawi,Jodawi,,"Earlier anti-corporate Sanders was being erased by corporate media. Now that has switched to anti-corporate Warren being erased. My theory is they can't reasonably keep the front-runner out, but they can keep out all the non-front-runners they don't like. https://twitter.com/adamcbest/status/1229913544189186049 …",[],['https://twitter.com/adamcbest/status/1229913544189186049'],[],0,0,0,[],[],https://twitter.com/jodawi/status/1230004743251980288,False,https://twitter.com/adamcbest/status/1229913544189186049,0,,,,,,,"[{'user_id': '7166802', 'username': 'jodawi'}]",,,,
1229938359969038337,1229865789018251264,1582075130000,2020-02-19,01:18:50,IST,7166802,jodawi,Jodawi,,"He's a coward though, so won't physically resist. The question is whether his supporters in the various broken branches will try to engineer real opposition to a peaceful transition. Also, if he feels betrayed by voters he'll probably try to cause as much damage as possible.",['amandacarpenter'],[],[],0,0,0,[],[],https://twitter.com/jodawi/status/1229938359969038337,False,,0,,,,,,,"[{'user_id': '7166802', 'username': 'jodawi'}, {'user_id': '14844867', 'username': 'amandacarpenter'}]",,,,
1229937738838724609,1229865789018251264,1582074982000,2020-02-19,01:16:22,IST,7166802,jodawi,Jodawi,,"He will at the very minimum pull more ""2nd amendment people will need to take things into their own hands"" bullshit. Not sure why that didn't disqualify him instantly. At a minimum, at least some of his supporters eill engage in acts of violence.",['amandacarpenter'],[],[],1,0,0,[],[],https://twitter.com/jodawi/status/1229937738838724609,False,,0,,,,,,,"[{'user_id': '7166802', 'username': 'jodawi'}, {'user_id': '14844867', 'username': 'amandacarpenter'}]",,,,
1229936071703576576,1229248697474715649,1582074585000,2020-02-19,01:09:45,IST,7166802,jodawi,Jodawi,,"Given the probability that Trump is a pawn of Putin, it would be prudent to strip and replace anything and everything that could have bugs hidden inside. No point in letting his treason continue to damage us when we can take steps to ameliorate it.","['almost_ten', 'mamatriedhoney']",[],[],0,0,1,[],[],https://twitter.com/jodawi/status/1229936071703576576,False,,0,,,,,,,"[{'user_id': '7166802', 'username': 'jodawi'}, {'user_id': '509142176', 'username': 'almost_ten'}, {'user_id': '1007632834411089921', 'username': 'MamaTriedHoney'}]",,,,
1229497717304381440,1229497717304381440,1581970073000,2020-02-17,20:07:53,IST,7166802,jodawi,Jodawi,,"Dammit, he didn't say it should be renamed to Trump Day and he didn't tweet that he's the best prez ever. Now I have predictive egg on my face.",[],[],[],0,0,2,[],[],https://twitter.com/jodawi/status/1229497717304381440,False,,0,,,,,,,"[{'user_id': '7166802', 'username': 'jodawi'}]",,,,
1229265435847081987,1229258486464172033,1581914693000,2020-02-17,04:44:53,IST,7166802,jodawi,Jodawi,,Cellophane bees banned in Seattle checkout lines,['beaq'],[],[],0,0,1,[],[],https://twitter.com/jodawi/status/1229265435847081987,False,,0,,,,,,,"[{'user_id': '7166802', 'username': 'jodawi'}, {'user_id': '3170651', 'username': 'beaq'}]",,,,
1229094516365254656,1229071389413511173,1581873942000,2020-02-16,17:25:42,IST,7166802,jodawi,Jodawi,,What model?,['tithonium'],[],[],1,0,0,[],[],https://twitter.com/jodawi/status/1229094516365254656,False,,0,,,,,,,"[{'user_id': '7166802', 'username': 'jodawi'}, {'user_id': '1547781', 'username': 'tithonium'}]",,,,
1228446877156134913,1228105319701794819,1581719533000,2020-02-14,22:32:13,IST,7166802,jodawi,Jodawi,,"I've spent a couple hours looking for harassing tweets and found one. I've seen many dozens of complaints about it though, without evidence to back it up. It would be useful to tag any such tweets to provide evidence for the claims.",['drjasonjohnson'],[],[],0,0,0,[],[],https://twitter.com/jodawi/status/1228446877156134913,False,,0,,,,,,,"[{'user_id': '7166802', 'username': 'jodawi'}, {'user_id': '50669520', 'username': 'DrJasonJohnson'}]",,,,
1228444588005658624,1228444588005658624,1581718987000,2020-02-14,22:23:07,IST,7166802,jodawi,Jodawi,, https://www.thenation.com/article/politics/warren-bloomberg-attack-democratic/ …,[],['https://www.thenation.com/article/politics/warren-bloomberg-attack-democratic/'],[],0,0,0,[],[],https://twitter.com/jodawi/status/1228444588005658624,False,,0,,,,,,,"[{'user_id': '7166802', 'username': 'jodawi'}]",,,,
1228444039831158784,1228444039831158784,1581718857000,2020-02-14,22:20:57,IST,7166802,jodawi,Jodawi,,Crazy used-car search sites make you start out choosing irrelevant things like body style and only later let you see what kind of sound system it has. I want premium audio and four tires dude.,[],[],[],0,0,0,[],[],https://twitter.com/jodawi/status/1228444039831158784,False,,0,,,,,,,"[{'user_id': '7166802', 'username': 'jodawi'}]",,,,
1228352462894927874,1228352462894927874,1581697023000,2020-02-14,16:17:03,IST,7166802,jodawi,Jodawi,,"Dear Intertweets, what other instruments should join a band that has an #autoharp and a #hurdygurdy?",[],[],[],0,0,0,"['#autoharp', '#hurdygurdy']",[],https://twitter.com/jodawi/status/1228352462894927874,False,,0,,,,,,,"[{'user_id': '7166802', 'username': 'jodawi'}]",,,,
1228204923835174914,1226265542182473733,1581661847000,2020-02-14,06:30:47,IST,7166802,jodawi,Jodawi,,"Warren, most others","['notoriousrbf', 'berniesanders']",[],[],0,0,0,[],[],https://twitter.com/jodawi/status/1228204923835174914,False,,0,,,,,,,"[{'user_id': '7166802', 'username': 'jodawi'}, {'user_id': '140776969', 'username': 'NotoriousRBF'}, {'user_id': '216776631', 'username': 'BernieSanders'}]",,,,
1228203722674585602,1227793197969092608,1581661561000,2020-02-14,06:26:01,IST,7166802,jodawi,Jodawi,,"What exactly is a ""BernieSanders surrogate""","['chrisjollyhale', 'berniesanders']",[],[],0,0,0,[],[],https://twitter.com/jodawi/status/1228203722674585602,False,,0,,,,,,,"[{'user_id': '7166802', 'username': 'jodawi'}, {'user_id': '23318036', 'username': 'chrisjollyhale'}, {'user_id': '216776631', 'username': 'BernieSanders'}]",,,,
1228194642732077060,1228020736452780032,1581659396000,2020-02-14,05:49:56,IST,7166802,jodawi,Jodawi,,"You're either a troll or misguided. Attack Warren with substantive valid arguments if you have them, in an appropriate place. Don't smear and damage Bernie's campaign and supporters with this pointless meme vitriol. #NontoxicBernieSupport","['elijhaisblessed', 'patrickakarlson', 'berniesanders']",[],[],0,0,0,['#nontoxicberniesupport'],[],https://twitter.com/jodawi/status/1228194642732077060,False,,0,,,,,,,"[{'user_id': '7166802', 'username': 'jodawi'}, {'user_id': '377509790', 'username': 'ElijhaIsBlessed'}, {'user_id': '3309139560', 'username': 'PatrickAKarlson'}, {'user_id': '216776631', 'username': 'BernieSanders'}]",,,,
1228115237015973888,1228115035060260864,1581640464000,2020-02-14,00:34:24,IST,7166802,jodawi,Jodawi,,Harder to deal with DMs etc tho,[],[],[],0,0,0,[],[],https://twitter.com/jodawi/status/1228115237015973888,False,,0,,,,,,,"[{'user_id': '7166802', 'username': 'jodawi'}]",,,,
1228115035060260864,1228115035060260864,1581640416000,2020-02-14,00:33:36,IST,7166802,jodawi,Jodawi,,"I think there needs to be an organized That's Not Bernie campaign to combat anyone (troll or otherwise) that claims to be a supporter but behaves inappropriately. Tired of hearing ""Bernie bros"" and ""Just as bad as MAGAs"". Can see Putin pouring money into toxic bogus Sanders bros.",[],[],[],1,0,2,[],[],https://twitter.com/jodawi/status/1228115035060260864,False,,0,,,,,,,"[{'user_id': '7166802', 'username': 'jodawi'}]",,,,
1228114497060999168,1227762178217910277,1581640288000,2020-02-14,00:31:28,IST,7166802,jodawi,Jodawi,,Resources at  https://www.ok.gov/health/Protective_Health/Injury_Prevention_Service/Intimate_Partner_Violence/index.html … in case you haven't seen. ❤❤❤❤❤,['kimster_giggles'],['https://www.ok.gov/health/Protective_Health/Injury_Prevention_Service/Intimate_Partner_Violence/index.html'],[],1,0,1,[],[],https://twitter.com/jodawi/status/1228114497060999168,False,,0,,,,,,,"[{'user_id': '7166802', 'username': 'jodawi'}, {'user_id': '797098900184334337', 'username': 'kimster_giggles'}]",,,,
1228111863201681408,1227999866804031488,1581639660000,2020-02-14,00:21:00,IST,7166802,jodawi,Jodawi,,"I think there needs to be an organized That's Not Bernie campaign to combat anyone (troll or otherwise) that claims to be a Bernie supporter but behaves inappropriately. Tired of hearing ""Bernie bros"" and ""Just as bad as MAGAs"".",['yashar'],[],[],0,0,0,[],[],https://twitter.com/jodawi/status/1228111863201681408,False,,0,,,,,,,"[{'user_id': '7166802', 'username': 'jodawi'}, {'user_id': '11744152', 'username': 'yashar'}]",,,,
